<?xml version="1.0" encoding="UTF-8"?>
<persona:person xmlns:persona="http://ed4becky.net/rootsPersona" xmlns:xsi="http://www.w3.org/2001/XMLSchema-instance"
    xsi:schemaLocation="http://ed4becky.net/rootsPersona ../schema/person.xsd" id="p000">
    <persona:characteristics>
        <persona:characteristic type="name">Unknown</persona:characteristic>
        <persona:characteristic type="gender">U</persona:characteristic>
    </persona:characteristics>
    <persona:events>
        <persona:event type="birth">
            <persona:date>Unknown</persona:date>
            <persona:place></persona:place>
        </persona:event>
        <persona:event type="death">
            <persona:date>Unknown</persona:date>
            <persona:place></persona:place>
        </persona:event>
        <persona:event type="marriage">
            <persona:date></persona:date>
            <persona:place></persona:place>
            <persona:person id="p000" />
        </persona:event>
    </persona:events>
    <persona:references>
        <persona:familyGroups>
            <persona:familyGroup selfType="child" refId="f000" />
            <persona:familyGroup selfType="parent" refId="f000" />
        </persona:familyGroups>
    </persona:references>
    <persona:relations>
        <persona:relation type="father">
            <persona:person id="p000" />
        </persona:relation>
        <persona:relation type="mother">
            <persona:person id="p000" />
        </persona:relation>
    </persona:relations>
</persona:person>