<?xml version="1.0" encoding="ISO-8859-1"?>
<persona:person xmlns:persona="http://ed4becky.net/rootsPersona" xmlns:xsi="http://www.w3.org/2001/XMLSchema-instance"
    xsi:schemaLocation="http://ed4becky.net/rootsPersona ../schema/person.xsd" id="p000">
	<persona:characteristics>
		<persona:characteristic type="name" />
		<persona:characteristic type="gender" />
	</persona:characteristics>
	<persona:events>
		<persona:event type="birth">
			<persona:date />
			<persona:place />
		</persona:event>
		<persona:event type="death">
			<persona:date />
			<persona:place />
		</persona:event>
		<persona:event type="marriage">
			<persona:date />
			<persona:place />
			<persona:person id="p000"/>
		</persona:event>
	</persona:events>
	<persona:references>
		<persona:familyGroups>
			<persona:familyGroup selfType="child" refId="f000" />
			<persona:familyGroup selfType="parent" refId="f000" />
		</persona:familyGroups>
	</persona:references>
	<persona:relations>
		<persona:relation type="father">
			<persona:person id="p000"/>
        </persona:relation>
		<persona:relation type="mother">
			<persona:person id="p000"/>
		</persona:relation>
	</persona:relations>
</persona:person>
